author,content,description,publishedAt,source/id,source/name,title,url,urlToImage
"Elizabeth Yuko","The past few weeks have been a trying time for everyone as we deal with the coronavirus pandemic. But for many people (myself included), some of the most stressful moments have come from discussing COVID-19 with our parents, grandparents and other older relat… [+8960 chars]","The past few weeks have been a trying time for everyone as we deal with the coronavirus pandemic. But for many people (myself included), some of the most stressful moments have come from discussing COVID-19 with our parents, grandparents and other older relat…","2020-03-17T18:30:00Z","","Lifehacker.com","How to Convince Your Parents or Grandparents that the Coronavirus is Dangerous","https://lifehacker.com/how-to-convince-your-parents-or-grandparents-that-the-c-1842358582","https://i.kinja-img.com/gawker-media/image/upload/c_fill,f_auto,fl_progressive,g_center,h_675,pg_1,q_80,w_1200/wckrfwpcxefi176iokpo.png"
"Marc DeAngelis","According to The Verge, the updated veggie meatballs will be made out of apples, oats, peas and potatoes. They'll be available both as an in-restaurant meal and a frozen package to make at home. IKEA hopes that the new taste will be more attractive to meat ea… [+576 chars]","A trip to IKEA isn't complete without a plate of Swedish meatballs. While the company offers a vegetarian version of its iconic meal, the veggie meatballs don't taste much like meat. Joining the trend set by fast food chains like Burger King and KFC, the furn…","2020-02-27T16:46:00Z","engadget","Engadget","IKEA’s new vegetarian meatballs will taste more like meat","https://www.engadget.com/2020/02/27/ikea-vegetarian-meatballs/","https://o.aolcdn.com/images/dims?thumbnail=1200%2C630&quality=80&image_uri=https%3A%2F%2Fo.aolcdn.com%2Fimages%2Fdims%3Fresize%3D2000%252C2000%252Cshrink%26image_uri%3Dhttps%253A%252F%252Fs.yimg.com%252Fos%252Fcreatr-images%252F2020-02%252F008ab370-597f-11ea-b7cb-9cfa73e20bdd%26client%3Da1acac3e1b3290917d92%26signature%3De0336d579c11a38643c4aef76b7ab29a4f57e17b&client=amp-blogside-v2&signature=6054ed648cf1ef48d020eba6f724b09430fe882c"
"Steve Dent","The wheels are pushed well to the corners to maximize space in the interior, which has plenty of the tech you'd expect in a concept EV. Joysticks are used to control it in place of a steering wheel and have buttons that let the driver access various functions… [+1841 chars]","Hyundai has unveiled a new concept EV called the Prophecy with an ultra-aerodynamic profile and joysticks instead of a steering wheel. Meant to be on display at the cancelled Geneva Motor Show, the electric car aims to convey Hyundai's current design style ca…","2020-03-03T07:00:00Z","engadget","Engadget","Hyundai's slippery Prophecy concept EV is controlled by joysticks","https://www.engadget.com/2020/03/03/hyundai-prophecy-concept-electric-car/","https://o.aolcdn.com/images/dims?thumbnail=1200%2C630&quality=80&image_uri=https%3A%2F%2Fo.aolcdn.com%2Fimages%2Fdims%3Fresize%3D2000%252C2000%252Cshrink%26image_uri%3Dhttps%253A%252F%252Fs.yimg.com%252Fos%252Fcreatr-uploaded-images%252F2020-03%252F10f60e40-5cad-11ea-bbff-f6a7613e644c%26client%3Da1acac3e1b3290917d92%26signature%3D687d258a4f7e17fa8fab35d76923f9fab8971957&client=amp-blogside-v2&signature=7ff89ce1f24a4cc4ca65e9b2ab58d91f755a6a75"
"Devindra Hardawar","""This season is based on my belief that we have what it takes to get to a real exciting future,"" Druyan said in an interview with Engadget. ""I base my belief on stories of the courage of our ancestors, the generations of searchers for the truth who have been … [+1911 chars]","In a time where it's easy to feel a bit concerned about the fate of civilization -- take your pick of calamities, really -- National Geographic's Cosmos is like a hope-filled salve. Developed by Ann Druyan, the co-creator of the original show together with he…","2020-03-06T17:30:00Z","engadget","Engadget","‘Cosmos: Possible Worlds’ finds hope for humanity in a hopeless era","https://www.engadget.com/2020/03/06/cosmos-possible-worlds-review/","https://o.aolcdn.com/images/dims?resize=1200%2C630&crop=1200%2C630%2C0%2C0&quality=80&image_uri=https%3A%2F%2Fo.aolcdn.com%2Fimages%2Fdims%3Fcrop%3D1600%252C900%252C0%252C0%26quality%3D85%26format%3Djpg%26resize%3D1600%252C900%26image_uri%3Dhttps%253A%252F%252Fs.yimg.com%252Fos%252Fcreatr-uploaded-images%252F2020-03%252F0a13c8d0-5fcb-11ea-af19-12366f51a842%26client%3Da1acac3e1b3290917d92%26signature%3D5c1d533eeb1643c32b91c016b809ac9be5722797&client=amp-blogside-v2&signature=38d1addb85d3d22cfb4c2ab4ffc96238ab84a000"
"Engadget","Goodbye doesn't mean forever.The gadgets that refuse to die\\n\\nAs Sonos most recently proved, your gadgets weren't meant to live forever. Any Engadget editor will point out his or her drawer or cupboard (or wardrobe) filled with tech from yesteryear. Not every … [+2662 chars]","Hey, good morning! You look fabulous. Amazon is offering faster same-day delivery that could get your order to you in a matter of hours. There will apparently be up to three million items marked ""Today by"" available to order for speedy same-day delivery to Pr…","2020-03-04T12:30:00Z","engadget","Engadget","The Morning After: Amazon's accelerated one-day shipping","https://www.engadget.com/2020/03/04/amazon-one-day-morning-after/","https://o.aolcdn.com/images/dims?thumbnail=1200%2C630&quality=80&image_uri=https%3A%2F%2Fo.aolcdn.com%2Fimages%2Fdims%3Fresize%3D2000%252C2000%252Cshrink%26image_uri%3Dhttps%253A%252F%252Fs.yimg.com%252Fos%252Fcreatr-uploaded-images%252F2020-03%252F132004c0-5e0e-11ea-becd-c4276a41dbcf%26client%3Da1acac3e1b3290917d92%26signature%3D85a381fe47bfa5b29bb090bc4ab5ea1768009969&client=amp-blogside-v2&signature=6d04f9936d288ba0bbfee372122ef23fdefdc77e"
"Gilad Edelman","For a brief moment there, it looked as though the coronavirus pandemic might escape the muck of partisanship. \\n\\nIts true that Donald Trump, wary of a recession during a reelection year, had first tried to talk the virus into submission. His counterfactual ins… [+4389 chars]","First deny the problem, then say the solution is too expensive? The playbook here is all too familiar.","2020-03-25T18:59:54Z","wired","Wired","The Analogy Between Covid-19 and Climate Change Is Eerily Precise","https://www.wired.com/story/the-analogy-between-covid-19-and-climate-change-is-eerily-precise/","https://media.wired.com/photos/5e7ba5188283f9000a41518c/191:100/w_1280,c_limit/Ideas-COVID-Climat-1207216812.jpg"
"Yessenia Funes on Earther, shared by Brian Kahn to Gizmodo","The world is warming. Thatsnosecret. Extreme heat isnt only dangerous for our physical health, though. New research shows hotter days may hurt our mental health as well.\\n\\nA study published Wednesday in the journal PLOS One adds to a growingbodyof literature s… [+5109 chars]","The world is warming. That’s no secret. Extreme heat isn’t only dangerous for our physical health, though. New research shows hotter days may hurt our mental health as well. Read more...","2020-03-26T16:40:00Z","","Gizmodo.com","Hotter Days May Leave You More Stressed, Depressed","https://earther.gizmodo.com/hotter-days-may-leave-you-more-stressed-depressed-1842509864","https://i.kinja-img.com/gawker-media/image/upload/c_fill,f_auto,fl_progressive,g_center,h_675,pg_1,q_80,w_1200/k3jn8rikqg7tygevgxpl.jpg"
"Dharna Noor on Earther, shared by Brian Kahn to Gizmodo","As both the coronavirus pandemic and the climate crisis provoke your anxieties, its important to remember all of the worlds wonderful possibilities. Which is why I present you: the impacts of nuclear war.\\n\\nA large-scale nuclear war is a nightmarish scenario t… [+4521 chars]","As both the coronavirus pandemic and the climate crisis provoke your anxieties, it’s important to remember all of the world’s wonderful possibilities. Which is why I present you: the impacts of nuclear war. Read more...","2020-03-16T19:05:00Z","","Gizmodo.com","Even a Relatively Small Nuclear War Would Cause Global Famine","https://earther.gizmodo.com/even-a-relatively-small-nuclear-war-would-cause-global-1842361610","https://i.kinja-img.com/gawker-media/image/upload/c_fill,f_auto,fl_progressive,g_center,h_675,pg_1,q_80,w_1200/ha2wcjah8swtaipozc9i.jpg"
"Dharna Noor on Earther, shared by Kaitlyn Jakola to Gizmodo","In the 1930s, manufacturers began using chlorofluorocarbonsgreenhouse gases made up of carbon, chlorine, and fluorineas refrigerants for air conditioners, aerosol sprays, refrigerators, freezers, and more. The problem is, those chemicals depleted the ozone la… [+2974 chars]","In the 1930s, manufacturers began using chlorofluorocarbons—greenhouse gases made up of carbon, chlorine, and fluorine—as refrigerants for air conditioners, aerosol sprays, refrigerators, freezers, and more. The problem is, those chemicals depleted the ozone …","2020-03-17T16:40:00Z","","Gizmodo.com","Old Air Conditioners and Refrigerators Are Keeping Us From Healing the Ozone Hole","https://earther.gizmodo.com/old-air-conditioners-and-refrigerators-are-keeping-us-f-1842379660","https://i.kinja-img.com/gawker-media/image/upload/c_fill,f_auto,fl_progressive,g_center,h_675,pg_1,q_80,w_1200/gzy3ldn7c1q07no4xxuk.jpg"
"Yessenia Funes on Earther, shared by Brian Kahn to Gizmodo","The worsening global crisis wrought by COVID-19 is leading to canceled international negotiations and wasteful ghost flights. And now its projected to lead to the first drop in oil demand in more than a decade.\\n\\nThe International Energy Agencys (IEA) updated … [+4286 chars]","The worsening global crisis wrought by COVID-19 is leading to canceled international negotiations and wasteful “ghost” flights. And now it’s projected to lead to the first drop in oil demand in more than a decade. Read more...","2020-03-09T16:02:00Z","","Gizmodo.com","Yearly Oil Demand Is Now Projected to Drop for the First Time in a Decade Due to COVID-19","https://earther.gizmodo.com/yearly-oil-demand-is-now-projected-to-drop-for-the-firs-1842211458","https://i.kinja-img.com/gawker-media/image/upload/c_fill,f_auto,fl_progressive,g_center,h_675,pg_1,q_80,w_1200/ot53phqjnes0grngf9ep.jpg"
"Yessenia Funes on Earther, shared by Brian Kahn to Gizmodo","The most recent Australian bushfire season from hell is one for the record books. And a new analysis published Wednesday shows all the ways humans made it worse, and its clearer than ever that climate change left its mark all over this disaster.\\n\\nThe findings… [+3222 chars]","The most recent Australian bushfire season from hell is one for the record books. And a new analysis published Wednesday shows all the ways humans made it worse, and it’s clearer than ever that climate change left its mark all over this disaster. Read more...","2020-03-04T18:40:00Z","","Gizmodo.com","We Now Know How Much Climate Change Contributed to Australia's Disastrous Bushfires","https://earther.gizmodo.com/we-now-know-how-much-climate-change-contributed-to-aust-1842090462","https://i.kinja-img.com/gawker-media/image/upload/c_fill,f_auto,fl_progressive,g_center,h_675,pg_1,q_80,w_1200/iarxg3unlsxqdueynj9m.jpg"
"Dharna Noor on Earther, shared by Brian Kahn to Gizmodo","On Wednesday, the Senate approved a $2 trillion covid-19 stimulus package. It could spell disaster for the climate.\\n\\nDemocrats failed to win the inclusion of tax credits for renewable energy or rules forcing airlines cut their greenhouse gas emissions. And th… [+2597 chars]","On Wednesday, the Senate approved a $2 trillion covid-19 stimulus package. It could spell disaster for the climate. Read more...","2020-03-26T16:58:00Z","","Gizmodo.com","How Fossil Fuel Companies Could Profit From the Covid-19 Stimulus Package","https://earther.gizmodo.com/how-fossil-fuel-companies-could-profit-from-the-covid-1-1842510430","https://i.kinja-img.com/gawker-media/image/upload/c_fill,f_auto,fl_progressive,g_center,h_675,pg_1,q_80,w_1200/xovbogsdfko7bppgyqmf.jpg"
"George Dvorsky on Earther, shared by Brian Kahn to Gizmodo","An individual involved with an international expedition to study the effects of climate change in the Arctic has tested positive for the coronavirus, in a development that could interrupt this important science mission.\\n\\nA team member of the expedition known … [+3959 chars]","An individual involved with an international expedition to study the effects of climate change in the Arctic has tested positive for the coronavirus, in a development that could interrupt this important science mission. Read more...","2020-03-11T21:36:00Z","","Gizmodo.com","Ice-Locked Arctic Science Expedition Faces Challenges After Team Member Tests Positive for COVID-19","https://earther.gizmodo.com/ice-locked-arctic-science-expedition-faces-challenges-a-1842275015","https://i.kinja-img.com/gawker-media/image/upload/c_fill,f_auto,fl_progressive,g_center,h_675,pg_1,q_80,w_1200/rxyajittipp7p3nqgh7s.jpg"
"Yessenia Funes on Earther, shared by Brian Kahn to Gizmodo","The first major Senate energy package in over a decade may not survive because a few Republicans are trying to block regulations on hydrofluorocarbons (HFCs), a potent greenhouse gas that can be found in air conditioners or refrigerators. \\n\\nSenators Lisa Murk… [+2378 chars]","The first major Senate energy package in over a decade may not survive because a few Republicans are trying to block regulations on hydrofluorocarbons (HFCs), a potent greenhouse gas that can be found in air conditioners or refrigerators. Read more...","2020-03-10T21:20:00Z","","Gizmodo.com","A Few Republicans Threaten to Derail a Giant Senate Energy Bill Over Air Conditioner Emissions","https://earther.gizmodo.com/a-few-republicans-threaten-to-derail-a-giant-senate-ene-1842245865","https://i.kinja-img.com/gawker-media/image/upload/c_fill,f_auto,fl_progressive,g_center,h_675,pg_1,q_80,w_1200/bg1bohnvqqn7mms0eysj.jpg"
"Dharna Noor on Earther, shared by Brian Kahn to Gizmodo","The U.S. government definitely has its priorities in order. Apparently, its considering using the coronavirus outbreak as an excuse to pour money into fossil fuel companies.\\n\\nThe Washington Post reports that the Trump administration is considering kicking mon… [+2933 chars]","The U.S. government definitely has its priorities in order. Apparently, it’s considering using the coronavirus outbreak as an excuse to pour money into fossil fuel companies. Read more...","2020-03-10T20:47:00Z","","Gizmodo.com","A Fracking Bailout Is A Terrible Idea","https://earther.gizmodo.com/a-fracking-bailout-is-a-terrible-idea-1842246263","https://i.kinja-img.com/gawker-media/image/upload/c_fill,f_auto,fl_progressive,g_center,h_675,pg_1,q_80,w_1200/bqx2t8ef3qxseto1t4zh.jpg"
"Yessenia Funes on Earther, shared by Brian Kahn to Gizmodo","As hopeless as solving the climate crisis can feel, solutions exist today. Realistic ones that wouldnt be costly. In fact, theyd make us richer than if we continue to ignore the risks of the crisis. \\n\\nA group of researchers compiled the 76 best ones on a list… [+4144 chars]","As hopeless as solving the climate crisis can feel, solutions exist today. Realistic ones that wouldn’t be costly. In fact, they’d make us richer than if we continue to ignore the risks of the crisis. Read more...","2020-03-03T21:40:00Z","","Gizmodo.com","New Report Lays Out 76 Solutions We Already Have to Fight the Climate Crisis","https://earther.gizmodo.com/new-report-lays-out-76-solutions-we-already-have-to-fig-1842064686","https://i.kinja-img.com/gawker-media/image/upload/c_fill,f_auto,fl_progressive,g_center,h_675,pg_1,q_80,w_1200/mfm2nrsylsvzwvzbm1wm.jpg"
"Tom McKay","The latest news from the White House on the ongoing spread of the novel coronavirus, which the Centers for Disease Control has warned is likely to hit the U.S. imminently, is not very reassuring: Vice President Mike Pence, whose poor epidemiological instincts… [+5727 chars]","The latest news from the White House on the ongoing spread of the novel coronavirus, which the Centers for Disease Control has warned is likely to hit the U.S. imminently, is not very reassuring: Vice President Mike Pence, whose poor epidemiological instincts…","2020-02-27T01:20:00Z","","Gizmodo.com","Trump: Don't Worry, We're Putting Mike Pence on This Coronavirus Thing","https://gizmodo.com/trump-dont-worry-were-putting-mike-pence-on-this-coro-1841943196","https://i.kinja-img.com/gawker-media/image/upload/c_fill,f_auto,fl_progressive,g_center,h_675,pg_1,q_80,w_1200/ahyw3v8sbc1htk6iaedc.jpg"
"Jocelyn Timperley on Earther, shared by Brian Kahn to Gizmodo","The United Nations official aviation body begins three weeks of talks this week. The International Civil Aviation Organization (ICAO) council meeting will discuss all manner of aviation-related topics, from coronavirus to unannounced missile launches. But it … [+11219 chars]","The United Nations’ official aviation body begins three weeks of talks this week. The International Civil Aviation Organization (ICAO) council meeting will discuss all manner of aviation-related topics, from coronavirus to unannounced missile launches. But it…","2020-03-05T16:39:00Z","","Gizmodo.com","How the UN's Shady Aviation Organization Could Upend a Key Effort to Combat Climate Change","https://earther.gizmodo.com/how-the-uns-shady-aviation-organization-could-upend-a-k-1842119869","https://i.kinja-img.com/gawker-media/image/upload/c_fill,f_auto,fl_progressive,g_center,h_675,pg_1,q_80,w_1200/pcxs8zlneujoaeqveowy.jpg"
"Dharna Noor on Earther, shared by Brian Kahn to Gizmodo","The European Commissions released its long-awaited climate law proposal in Brussels on Wednesday. It would commit the 27 nations in the EU to become carbon neutral by 2050. To pass, the law needs the approval of the European Parliament and the EUs 27 member s… [+4075 chars]","The European Commission’s released its long-awaited climate law proposal in Brussels on Wednesday. It would commit the 27 nations in the EU to become carbon neutral by 2050. To pass, the law needs the approval of the European Parliament and the EU’s 27 member…","2020-03-04T19:38:00Z","","Gizmodo.com","The Huge Holes in the EU's New Climate Law Proposal","https://earther.gizmodo.com/the-huge-holes-in-the-eus-new-climate-law-proposal-1842093077","https://i.kinja-img.com/gawker-media/image/upload/c_fill,f_auto,fl_progressive,g_center,h_675,pg_1,q_80,w_1200/nuganf0pau1yspuboyya.jpg"
"Niko Vorobyov on Earther, shared by Brian Kahn to Gizmodo","The dark, rocky face of the Dois Irmãos Mountain rises over the rainforest and through the clouds, overlooking the largest slum in Latin America. A young man emerges from around the corner of an alleyway to meet me with a handgun tucked under his arm; the loc… [+13416 chars]","The dark, rocky face of the Dois Irmãos Mountain rises over the rainforest and through the clouds, overlooking the largest slum in Latin America. A young man emerges from around the corner of an alleyway to meet me with a handgun tucked under his arm; the loc…","2020-02-26T16:30:00Z","","Gizmodo.com","Brazil Is Cracking Down on Climate Migrants While Worsening the Climate Crisis","https://earther.gizmodo.com/brazil-is-cracking-down-on-climate-migrants-while-worse-1841796897","https://i.kinja-img.com/gawker-media/image/upload/c_fill,f_auto,fl_progressive,g_center,h_675,pg_1,q_80,w_1200/lkrj51nuubckgkvr680d.gif"
"Amy Brady on Earther, shared by Brian Kahn to Gizmodo","Growing up in the Norwegian Arcticone of the coldest places on Earthjournalist Bjørn Vassnes became fascinated with the natural sciences. Today, he pens a science column for one of Norways most popular daily newspapers and hosts the television science program… [+7542 chars]","Growing up in the Norwegian Arctic—one of the coldest places on Earth—journalist Bjørn Vassnes became fascinated with the natural sciences. Today, he pens a science column for one of Norway’s most popular daily newspapers and hosts the television science prog…","2020-03-24T15:07:00Z","","Gizmodo.com","Kingdom of Frost Explores How Frozen Landscapes Shaped Humanity","https://earther.gizmodo.com/kingdom-of-frost-explores-how-frozen-landscapes-shaped-1842470580","https://i.kinja-img.com/gawker-media/image/upload/c_fill,f_auto,fl_progressive,g_center,h_675,pg_1,q_80,w_1200/y63vx5wuyomvs8zmymnq.jpg"
"Bryan Menegus","Sick DaysWelcome to Sick Days, a collection of stories from readers on how the current covid-19 health crisis is changing the way they work and the futures they can expect in these uncertain times.\\n\\nThis is the first edition of Sick Days, a new series documen… [+16622 chars]","Read more...","2020-03-19T17:30:00Z","","Gizmodo.com","Sick Days: Stories From People Keeping the World Running","https://gizmodo.com/sick-days-stories-from-people-keeping-the-world-runnin-1842410993","https://i.kinja-img.com/gawker-media/image/upload/c_fill,f_auto,fl_progressive,g_center,h_675,pg_1,q_80,w_1200/eqbricapqkizzvpfcexr.png"
"Mark Stetson","Your planet has warmed up by nearly 2 degrees Fahrenheit, or just over 1 degree Celsius, since the late 1800s. Were on track to warm Earth by around another 3.5 degrees Fahrenheit this century.","Your planet has warmed up by nearly 2 degrees Fahrenheit, or just over 1 degree Celsius, since the late 1800s. We’re on track to warm Earth by around another 3.5 degrees Fahrenheit this century. Read more... More about Science, Mashable Video, Environment, Gl…","2020-03-05T17:53:19Z","mashable","Mashable","Even the 'optimistic' climate change forecast is catastrophic","https://mashable.com/video/catastrophic-climate-change/","https://mondrian.mashable.com/2020%252F03%252F05%252Fe9%252Fcbd806c7b7874b5c923e49be0e864b58.b2993.png%252F1200x630.png?signature=ouCehFPsl3bjhzgTuNyc_xoqPCk="
"Mark Kaufman","Some 80 million passengers fly through London's Heathrow Airport each year, but to boost its capacity by another 50 million, the airport seeks to add a third runway. This could make Heathrow, by far, the busiest airport on Earth.\\n\\nBut three UK judges on Thurs… [+4529 chars]","Some 80 million passengers fly through London's Heathrow Airport each year, but to boost its capacity by another 50 million, the airport seeks to add a third runway. This could make Heathrow, by far, the busiest airport on Earth. But three UK judges on Thursd…","2020-02-27T18:38:06Z","mashable","Mashable","Major new airport runway nixed because of the warming planet","https://mashable.com/article/heathrow-airport-runway-blocked-climate-change/","https://mondrian.mashable.com/2020%252F02%252F27%252Ff4%252F3b8420030cd547809f054795adba0770.47b84.jpg%252F1200x630.jpg?signature=OVMOABCJuHSOsdnpPdVhaud9nOs="
"Mark Kaufman","The greatest masses of ice on Earth, in Antarctica and Greenland, aren't just melting this melt is accelerating. \\n\\nHow much ice are these critical polar regions losing into the oceans? NASA uses satellites to diligently measure the conditions of these colossa… [+2601 chars]","The greatest masses of ice on Earth, in Antarctica and Greenland, aren't just melting — this melt is accelerating. How much ice are these critical polar regions losing into the oceans? NASA uses satellites to diligently measure the conditions of these colossa…","2020-03-13T16:16:17Z","mashable","Mashable","NASA sticks a colossal ice block in NYC in new video","https://mashable.com/article/antarctica-greenland-melting-gigatonne-ice/","https://mondrian.mashable.com/2020%252F03%252F13%252F9b%252F990df7c1ddf44aa5aa054327a488e00e.5a7a5.png%252F1200x630.png?signature=EDu7gD6QEPaL038oqXBPdwkRpZQ="
"Mark Kaufman","Some 8,000 miles from the elegantly carpeted U.S. Capitol in Washington, D.C., lies an eerie, dark, underwater place a place that threatens to redraw maps all over the globe. This realm, found under a nearly 2,000-foot-thick slab of ice in Antarctica, is wher… [+10537 chars]","Some 8,000 miles from the elegantly carpeted U.S. Capitol in Washington, D.C., lies an eerie, dark, underwater place — a place that threatens to redraw maps all over the globe. This realm, found under a nearly 2,000-foot-thick slab of ice in Antarctica, is wh…","2020-02-27T11:00:00Z","mashable","Mashable","What, exactly, does Congress understand about the world's most threatening glacier?","https://mashable.com/article/thwaites-glacier-what-congress-knows/","https://mondrian.mashable.com/2020%252F02%252F27%252F5f%252F6a940845d3334d70886e33192cda458a.62790.jpg%252F1200x630.jpg?signature=LmuFMCn5UoNb_UrWfwSFhvddCJ0="
"Mark Kaufman","The surge in New York City's coronavirus infections is already so critical that the chief medical officer at a major hospital system warned staff of the grim reality: ""...there will be loss, and suffering, and at times perhaps each of us will question our wil… [+5255 chars]","The surge in New York City's coronavirus infections is already so critical that the chief medical officer at a major hospital system warned staff of the grim reality: ""...there will be loss, and suffering, and at times perhaps each of us will question our wil…","2020-03-26T10:00:00Z","mashable","Mashable","Coronavirus won’t make a dent in the climate problem","https://mashable.com/article/coronavirus-carbon-emissions-climate/","https://mondrian.mashable.com/2020%252F03%252F25%252F0e%252Fdb8018a4267440d4bc5cf595f339ad2d.6e162.png%252F1200x630.png?signature=NEnoq-JJ3SrEDVKf15bfyiwKO0A="
