author,content,description,publishedAt,source/id,source/name,title,url,urlToImage
"Nathanial Gronewold, E&E News","Smoke from Australia’s disastrous bush fires killed hundreds of people and sent thousands to hospitals and emergency rooms, according to a new study.\\n\\nThe estimated death toll does not include fatalities resulting directly from the flames that spread across m… [+2005 chars]","Exposure to particulate matter led to heart and lung problems for thousands -- Read more on ScientificAmerican.com","2020-03-24T17:30:00Z","","Scientificamerican.com","Smoke from Australia's Bushfires Killed Hundreds","https://www.scientificamerican.com/article/smoke-from-australias-bushfires-killed-hundreds1/","https://static.scientificamerican.com/sciam/cache/file/D80CA9DF-EAB1-4238-9C8AF68654AFAC43.jpg"
"Chelsea Harvey, E&E News","The notorious Antarctic “ozone hole” sparked worldwide concern after its discovery in the 1980s, and for good reason — declining ozone allows harmful ultraviolet radiation to reach the Earth’s surface, a major threat to public health.\\n\\nBut the ozone hole had … [+5067 chars]","The Southern Hemisphere jet stream is shifting, bringing more rain to some spots and less to others -- Read more on ScientificAmerican.com","2020-03-26T17:30:00Z","","Scientificamerican.com","Shrinking Ozone Hole, Climate Change Are Causing Atmospheric ""Tug of War""","https://www.scientificamerican.com/article/shrinking-ozone-hole-climate-change-are-causing-atmospheric-tug-of-war/","https://static.scientificamerican.com/sciam/cache/file/6DB2493F-3543-45C1-8E08C2CEB23BC4C8.jpg"
"Wade Roush","Ocean water expands as it soaks up heat from a warming atmosphere. Add in water from melting glaciers and ice sheets, and the global mean sea level will most likely rise by anywhere from 1.4 to 2.8 feet (43 to 84 centimeters) by 2100, according to the Intergo… [+3715 chars]","Failing to protect our coasts from sea-level rise would cost vastly more -- Read more on ScientificAmerican.com","2020-03-13T13:00:00Z","","Scientificamerican.com","Pricey Storm-Surge Barriers May Be Worth It","https://www.scientificamerican.com/article/pricey-storm-surge-barriers-may-be-worth-it/","https://static.scientificamerican.com/sciam/cache/file/87C01B5E-9F48-4FDC-BD256AA4F62F0E93.jpg"
"John Fialka, E&E News","Companies in the U.S. natural gas industry have begun to scale up a program to sell methane that’s recycled from sources like hog-feeding farms and sewage plants as a replacement for natural gas drawn from wells.\\n\\nIt offers an opportunity to reduce a potent g… [+9272 chars]","Methane can be captured from human and animal waste and energy and heating -- Read more on ScientificAmerican.com","2020-03-06T18:00:00Z","","Scientificamerican.com","Gas Companies Want to Recycle Your Manure","https://www.scientificamerican.com/article/gas-companies-want-to-recycle-your-manure/","https://static.scientificamerican.com/sciam/cache/file/B596CD51-B4DC-457B-8B36ABD760C2C585.jpg"
"Alex Lubben, VICE News","Want the best of VICE News straight to your inbox? Sign up here.\\n\\nEurope had, by far, its hottest winter on record this year. \\n\\nWhen temperature records are broken, its usually by a sliver of a degree. But this winter, Europe was hotter by a whopping 6.12 deg… [+2721 chars]","In Germany, the grapes used for ice wine never even froze.","2020-03-05T18:34:26Z","vice-news","Vice News","Buongiorno, It Was Really Hot in Europe This Winter","https://www.vice.com/en_us/article/wxe7nm/buongiorno-it-was-really-hot-in-europe-this-winter","https://video-images.vice.com/test-uploads/articles/5e6135f303a008009d200ab1/lede/1583429582683-AP_20017531734507.jpeg?crop=1xw:0.819518236645606xh;center,center&resize=1200:*"
"Geoff Dembicki, Harry Cheadle","Two people who were central to creating the 2015 Paris agreement have written a step-by-step guide for what you can personally do to fix the climate emergency. It includes such tips as setting aside time each day to do a ""breathing exercise of gratitude,"" cul… [+9854 chars]","Christiana Figueres' new book, 'The Future We Choose,' showcases the kind of climate activism rich people love.","2020-02-27T15:27:12Z","vice-news","Vice News","The Architect of the Paris Agreement Wants Us to Forgive… Oil Executives?","https://www.vice.com/en_us/article/4ag7dq/the-architect-of-the-paris-agreement-wants-us-to-forgive-oil-executives","https://video-images.vice.com/test-uploads/articles/5e57d96e2e0d32009bf27648/lede/1582816024452-ARC_Getty_170408973_Businessman_in_private_jet_with_drink_VICE_RF.jpeg?crop=1xw:0.8425xh;0xw,0.1511xh&resize=1200:*"
"https://www.facebook.com/bbcnews","Image copyrightGetty ImagesImage caption\\n\\n Investors are facing scrutiny like never before\\n\\nEver wondered if your bank or insurance company is funding the coal industry? Or whether your pension fund is backing oil companies drilling new wells in the Arctic?\\n\\n… [+3312 chars]","Investors are facing scrutiny like never before about what they're doing to tackle climate change.","2020-02-27T09:55:14Z","bbc-news","BBC News","Climate change: Pressure on big investors to act on environment","https://www.bbc.co.uk/news/science-environment-51657829","https://ichef.bbci.co.uk/news/1024/branded_news/7F73/production/_110872623_bp.jpg"
"https://www.facebook.com/bbcnews","Media captionWhy is Antarctica's mighty Thwaites Glacier melting?\\n\\nEarth's great ice sheets, Greenland and Antarctica, are now losing mass six times faster than they were in the 1990s thanks to warming conditions.\\n\\nA comprehensive review of satellite data acq… [+4108 chars]","The Earth's great ice sheets are losing mass six times faster today than they were in the 1990s.","2020-03-12T04:34:41Z","bbc-news","BBC News","Greenland and Antarctica ice loss accelerating","https://www.bbc.co.uk/news/science-environment-51846468","https://ichef.bbci.co.uk/images/ic/1024x576/p081srz8.jpg"
"Kemal Derviş, Sebastián Strauss","Throughout history, crisis and human progress have often gone hand in hand. While the growing COVID-19 threat could strengthen nationalism and isolationism and accelerate the retreat from globalization, the outbreak also could spur a new wave of international… [+6860 chars]","Both threats raise the question of how the world should organize itself against the threat of pandemics.","2020-03-07T16:58:06Z","","Marketwatch.com","Project Syndicate: Amid rise of nationalism, coronavirus and climate change may spur a new wave of international cooperation","http://www.marketwatch.com/story/amid-rise-of-nationalism-coronavirus-and-climate-change-may-spur-a-new-wave-of-international-cooperation-2020-03-07","https://s.marketwatch.com/public/resources/images/MW-IB736_corona_ZH_20200307114308.jpg"
