author,content,description,publishedAt,source/id,source/name,title,url,urlToImage
"https://www.facebook.com/bbcnews","Image copyrightGetty ImagesImage caption\\n\\n Greta Thunberg accused the EU of ""pretending"" to tackle climate change\\n\\nSwedish teen activist Greta Thunberg has rebuked the EU's plan for tackling climate change, telling MEPs it amounts to ""surrender"".\\n\\nMs Thunberg… [+2963 chars]","Addressing MEPs in Brussels, the activist accused the EU of ""pretending to be a climate leader"".","2020-03-04T17:35:44Z","bbc-news","BBC News","Greta Thunberg brands EU's new climate law 'surrender'","https://www.bbc.co.uk/news/world-europe-51736134","https://ichef.bbci.co.uk/news/1024/branded_news/16C27/production/_111132239_060429446-1.jpg"
"Chandelis Duster, CNN","Washington (CNN)An Interior Department official pushed misleading information about climate change into the agency's reports, according to The New York Times, at a time when the Trump administration has rolled back environmental protection regulations and rep… [+2106 chars]","An Interior Department official pushed misleading information about climate change into the agency's reports, according to The New York Times, at a time when the Trump administration has rolled back environmental protection regulations and repeatedly downplay…","2020-03-02T15:38:24Z","cnn","CNN","NYT: Interior official pushes misleading information on climate crisis in reports","https://www.cnn.com/2020/03/02/politics/interior-official-climate-change/index.html","https://cdn.cnn.com/cnnnext/dam/assets/181011133844-department-of-interior-seal-super-tease.jpg"
"https://www.facebook.com/bbcnews","Image copyrightSterling CaviarImage caption\\n\\n More caviar might have to come from farmed sturgeon\\n\\nOverfishing has depleted numbers of wild fish, and fish farms meet much of the growing demand. Could we one day be eating ""fish"" grown from cells in a factory, … [+5170 chars]","Start-ups are growing fish ""meat"" in labs and say it will be competitive with fish from the sea.","2020-03-24T01:38:07Z","bbc-news","BBC News","Could synthetic fish be a better catch of the day?","https://www.bbc.co.uk/news/business-51657573","https://ichef.bbci.co.uk/news/1024/branded_news/6C86/production/_111128772_wilton_loading_fish.jpg"
"Scott K. Johnson","2 with 2 posters participating\\n\\nA paper published last June was catnip for those who are desperate to explain climate change with anything but human-caused greenhouse gas emissions. It was also apparently wrong enough to be retracted this week by the journal … [+6106 chars]","It turns out the Earth is also subject to gravity, which was a problem.","2020-03-06T17:58:49Z","ars-technica","Ars Technica","Paper that claimed the Sun caused global warming gets retracted","https://arstechnica.com/science/2020/03/paper-that-claimed-the-sun-caused-global-warming-gets-retracted/","https://cdn.arstechnica.net/wp-content/uploads/2020/03/nasa_386_SunEmitsSolsticeFlare1200w-760x380.jpg"
"Jennifer Ouellette","Enlarge/ Widely known and revered in southeast Asia as the ""king of fruits"", the durian is distinctive for its large size, strong odor (often compared to rotten onions, raw sewage, or turpentine), and formidable thorn-covered husk\\n\\n0 with 0 posters participat… [+5280 chars]","Durian and jackfruit make better, cheaper aerogels for super-capacitors","2020-03-07T20:00:30Z","ars-technica","Ars Technica","Super-stinky durian fruit could charge your cell phone someday","https://arstechnica.com/science/2020/03/super-stinky-durian-fruit-could-charge-your-cell-phone-someday/","https://cdn.arstechnica.net/wp-content/uploads/2020/03/durianTOP-760x380.jpg"
"Eric M. Johnson","SEATTLE (Reuters) - Boeing Co (BA.N) plans to restart 737 MAX production by May, ending a months-long halt triggered by a safety ban on its best-selling jet after fatal crashes, people familiar with the matter said on Tuesday. \\n\\nBoeing’s planning hinges on th… [+2137 chars]","Boeing Co plans to restart 737 MAX production by May, ending a months-long halt triggered by a safety ban on its best-selling jet after fatal crashes, people familiar with the matter said on Tuesday.","2020-03-25T00:06:20Z","reuters","Reuters","Exclusive: Boeing plans 737 MAX production restart by May - sources","https://www.reuters.com/article/us-boeing-737max-production-exclusive-idUSKBN21C005","https://s2.reutersmedia.net/resources/r/?m=02&d=20200325&t=2&i=1507761086&w=1200&r=LYNXMPEG2O004"
"Isabella Gomez Sarmiento","Students at Pole Pressure in Washington, D.C. combine strength, flexibility and creativity to learn routines in class.\\n\\nKisha Ravi/NPR\\n\\nIt's Friday afternoon, and 12 people are gathered in a pole dancing class in Washington, D.C. They start warming up in fron… [+4858 chars]","The International Pole Sports Federation is working to get pole dancing permanently recognized as a sport. Advocates say it combines strength, flexibility, creativity and a whole lot of training.","2020-03-12T13:01:20Z","","Npr.org","Pole Dancing Made It To The Super Bowl. Now It Wants Another Stage: The Olympics","https://www.npr.org/2020/03/12/813961406/pole-dancing-made-it-to-the-super-bowl-now-it-wants-another-stage-the-olympics","https://media.npr.org/assets/img/2020/03/10/_dsc0195_wide-d9cf3566f5fa25098cdea196d7e9f59831b2808b.jpg?s=1400"
"Nathan Rott","Karen Ford (left) and Lane Murraya stock rescued koalas with fresh eucalyptus branches. Ford has been collecting the branches on her property, which suffered fire damage.\\n\\nNathan Rott/NPR\\n\\nIn the back corner of a burned lot in Australia's fire-ravaged South C… [+7920 chars]","After devastating fires, there are signs of regrowth across much of eastern Australia. But there's also concern that a changing climate may alter some of the country's unique landscapes forever.","2020-03-14T11:00:32Z","","Npr.org","Australia's Fire-Ravaged Forests are Recovering. Ecologists Hope It Lasts","https://www.npr.org/2020/03/14/810152967/australias-fire-ravaged-forests-are-recovering-ecologists-hope-it-lasts","https://media.npr.org/assets/img/2020/03/13/australia-rott-1_wide-b122a4ea164c478d86710f206ab196e50c8ad736.jpg?s=1400"
"Brian Kateman","February\\n\\n26, 2020\\n\\n8 min read\\n\\nOpinions expressed by Entrepreneur contributors are their own.\\n\\nThe U.S. is seeing incredible technological innovation in the plant-based food industry. The quality of products, and their likeness to animal-based meat, continue… [+8694 chars]","While the U.S. is seeing a huge appetite for plant-based meat and cutting-edge innovation, the rest of the world is also waking up to peoples' demand for a healthier, more sustainable way of living and eating.","2020-02-26T21:00:00Z","","Entrepreneur.com","Plant-based Meat Has Officially Reached 'Global Phenomenon' Status","https://www.entrepreneur.com/article/346116","https://assets.entrepreneur.com/content/3x2/2000/20200225215842-GettyImages-1181103851.jpeg"
"David Wallace-Wells, contact@ted.com (TED)","","The climate crisis is too vast and complicated to solve with a silver bullet, says author David Wallace-Wells. What we need is a shift in how we live. Follow along as he lays out some of the dramatic actions we could take to build a livable, prosperous world …","2020-03-13T19:09:40Z","","Ted.com","How we could change the planet's climate future | David Wallace-Wells","https://www.ted.com/talks/david_wallace_wells_how_we_could_change_the_planet_s_climate_future","https://pi.tedcdn.com/r/talkstar-photos.s3.amazonaws.com/uploads/e767b59e-5512-446d-9708-1bc449ef8206/DavidWallace-Wells_2019S-embed.jpg?c=1050%2C550&w=1050"
"Lou Shipley","Teslas recent breakout market performance is proving some of its \\n\\n skeptics wrong.By mid-January, Teslas market capitalization had reached $107 billion, and it surged past the giant German automaker Volkswagen to become the worlds second most valuable auto c… [+5625 chars]","It’s ushering in the age of the software car.","2020-02-28T15:30:55Z","","Hbr.org","How Tesla Sets Itself Apart","https://hbr.org/2020/02/how-tesla-sets-itself-apart","https://hbr.org/resources/images/article_assets/2020/02/hbrtesladesign3.jpg"
"","(Bloomberg) — Diplomacy can fix large-scale harm done to the planet by industrial pollution. \\n\\nThat’s the conclusion of new research published today in the journal Nature showing how skies above the Southern Hemisphere have recovered since a 1987 treaty banne… [+3366 chars]","Southern Skies Benefit from a Rare Climate-Diplomacy Success Financial Post Global efforts on ozone help reverse southern jet stream damage The Guardian International ozone treaty stops changes in Southern Hemisphere winds Phys.org View Full coverage on Googl…","2020-03-25T16:16:00Z","financial-post","Financial Post","Southern Skies Benefit from a Rare Climate-Diplomacy Success - Financial Post","https://business.financialpost.com/pmn/business-pmn/southern-skies-benefit-from-a-rare-climate-diplomacy-success","https://secure.gravatar.com/blavatar/b4ece3189893389a03f063830eacd95c?s=200&ts=1585160729"
"Jordan Davidson","The Great Barrier Reef, a natural wonder that once teemed with life, just experienced a major coral bleaching event, according to scientists who conducted aerial surveys over hundreds of individual reefs, as The Guardian reported. \\n\\nAccording to NBC News, the… [+2942 chars]","Great Barrier Reef Has Third Major Bleaching Event in Five Years EcoWatch Great Barrier Reef Hit By Mass Bleaching, Climate Council Says Bloomberg The Great Barrier Reef likely just experienced its most widespread bleaching event on record CNN View Full cover…","2020-03-25T19:55:00Z","","Ecowatch.com","Great Barrier Reef Has Third Major Bleaching Event in Five Years - EcoWatch","https://www.ecowatch.com/coral-bleaching-great-barrier-reef-2645576557.html","https://assets.rebelmouse.io/eyJhbGciOiJIUzI1NiIsInR5cCI6IkpXVCJ9.eyJpbWFnZSI6Imh0dHBzOi8vYXNzZXRzLnJibC5tcy8yMjg5NzAyNi9vcmlnaW4uanBnIiwiZXhwaXJlc19hdCI6MTYzNDc1MTQ0NX0.z1Q74PB6motdzWt3pB8jAuW08_a8zd0wo3_7bjWaIWE/img.jpg?width=1200&coordinates=0%2C66%2C0%2C67&height=600"
"Joel Achenbach","The cause was complications from a fall, said a son, George Dyson.\\n\\nMr. Dyson, born in England between the world wars, spent most of his professional life as a kind of genius-in-residence at the Institute for Advanced Study in Princeton, overlapping in his ea… [+10716 chars]","Freeman Dyson, a visionary and renaissance physicist, dies at 96 The Washington Post The man behind the sphere, Freeman Dyson, is dead at 96 Ars Technica Freeman Dyson, legendary theoretical physicist, dies at 96 National Geographic Freeman Dyson, famed physi…","2020-02-28T18:48:00Z","the-washington-post","The Washington Post","Freeman Dyson, a visionary and renaissance physicist, dies at 96 - The Washington Post","https://www.washingtonpost.com/local/obituaries/freeman-dyson-a-visionary-and-renaissance-physicist-dies-at-96/2020/02/28/0ba462e0-5a58-11ea-ab68-101ecfec2532_story.html","https://www.washingtonpost.com/resizer/laop_913Jove4TQNiAxhmApyfhA=/1440x0/smart/arc-anglerfish-washpost-prod-washpost.s3.amazonaws.com/public/P2IJR3S2LII6VDX5B6IEXXMAK4.jpg"
"","NASA's new three-dimensional portrait of methane concentrations shows the world's second largest contributor to greenhouse warming, the diversity of sources on the ground, and the behavior of the gas as it moves through the atmosphere. Combining multiple data… [+6898 chars]","New 3D View of Methane Tracks Sources Lab Manager Magazine","2020-03-24T13:41:15Z","","Labmanager.com","New 3D View of Methane Tracks Sources - Lab Manager Magazine","https://www.labmanager.com/news/new-3d-view-of-methane-tracks-sources-22093","https://lmg-labmanager.s3.amazonaws.com/assets/articleNo/22093/aImg/40907/new-3d-view-of-methane-tracks-sources-and-movement-m.jpg"
"Hannah Knowles","Astronomers expect mini-moon sightings to grow far more common as a new, giant telescope going up in Chile starts scanning the sky. Its an exciting prospect for scientists interested in someday sending a spacecraft to study one of the rocks and maybe even bri… [+3816 chars]","Earth’s new ‘mini-moon’ is leaving soon. But it’ll be back. The Washington Post The 9@9: Southtown business owner to rebuild after fire; 'Mini moon' orbiting around Earth KSAT 12 Earth's New Mini-Moon Captured in Color Image Gizmodo Earth’s got a new ‘moon’ –…","2020-02-28T21:45:00Z","the-washington-post","The Washington Post","Earth’s new ‘mini-moon’ is leaving soon. But it’ll be back. - The Washington Post","https://www.washingtonpost.com/science/2020/02/28/mini-moon-2020-cd3/","https://www.washingtonpost.com/resizer/6i8JpWFfBBB7OvsEQspgFX2tgto=/1440x0/smart/arc-anglerfish-washpost-prod-washpost.s3.amazonaws.com/public/QCYTQ5JSAFAUXDVN2BZCV7UTGI.gif"
"","Good morning,\\n\\nThese are the top stories:\\n\\nCoastal GasLink estimates $115-million in payments to elected Wetsuweten band councils\\n\\nStory continues below advertisement\\n\\nThe company projected that its B.C. pipeline project would pump $115-million during a 25-ye… [+8384 chars]","Morning Update: Coastal GasLink estimates $115-million in payments to elected Wet’suwet’en band councils The Globe and Mail Three-week Quebec rail blockade voluntarily dismantled, protesters move camp away from train tracks National Post As Quebec rail blocka…","2020-03-06T11:52:25Z","the-globe-and-mail","The Globe And Mail","Morning Update: Coastal GasLink estimates $115-million in payments to elected Wet’suwet’en band councils - The Globe and Mail","https://www.theglobeandmail.com/canada/article-morning-update-coastal-gaslink-estimates-115-million-in-payments-to/","https://www.theglobeandmail.com/resizer/jg-2SyXuCPHZgUU_ZQYZ8IBOnDQ=/1200x0/filters:quality(80)/arc-anglerfish-tgam-prod-tgam.s3.amazonaws.com/public/TMORCC6H7VHZBO6JBJPQMQ3RQY.JPG"
"Heather Alexandra","2016s Doom reimagined the classic shooter into a frantic but modern mold. The bloody escapades of the Doom Slayer were rife with bullets and guts. It was a grimy video game hamburger. Doom Eternal is bigger and bloodier, almost to the point of excess. Its the… [+19358 chars]","2016’s Doom reimagined the classic shooter into a frantic but modern mold. The bloody escapades of the Doom Slayer were rife with bullets and guts. It was a grimy video game hamburger. Doom Eternal is bigger and bloodier, almost to the point of excess. It’s t…","2020-03-24T15:30:00Z","","Kotaku.com","Doom Eternal: The Kotaku Review","https://kotaku.com/doom-eternal-the-kotaku-review-1842471145","https://i.kinja-img.com/gawker-media/image/upload/c_fill,f_auto,fl_progressive,g_center,h_675,pg_1,q_80,w_1200/izxcva4tobordgfsbarc.jpg"
"Mark Frauenfelder","(I originally reviewed this in 2008, but thought it was worth reposting, for obvious reasons. -- MF) In World Made By Hand (2008) by James Howard Kunstler, the population of the United States (and most likely, the world) has been decimated by an energy shorta… [+2925 chars]","(I originally reviewed this in 2008, but thought it was worth reposting, for obvious reasons. -- MF) In World Made By Hand (2008) by James Howard Kunstler, the population of the United States (and most likely, the world) has been decimated by an energy shorta…","2020-03-23T21:33:45Z","","Boingboing.net","World Made By Hand is a post-pandemic world novel","https://boingboing.net/2020/03/23/world-made-by-hand-b.html","https://i2.wp.com/media.boingboing.net/wp-content/uploads/2020/03/Untitled-1-2.jpg?fit=680%2C486&ssl=1"
"Kyle Wiggers","FairShake (formerly Radvocate) is a startup that taps automation and human review to expedite settling consumer disputes with companies. It helps deliver legal notices to companies and, if necessary, bring the claims to consumer arbitration. And three years a… [+2985 chars]","FairShake, a startup developing a platform that automates consumer dispute filings, has raised $3 million as it prepares to relaunch and rebrand.","2020-03-03T15:00:26Z","","Venturebeat.com","FairShake raises $3 million to automate consumer dispute filings","https://venturebeat.com/2020/03/03/fairshake-raises-3-million-to-automate-consumer-dispute-filings/","https://venturebeat.com/wp-content/uploads/2020/02/0-1-e1582309980464.jpeg?w=1200&strip=all"
"Evan Meagher","Over the past five years, Ive worked at two startups in what is now being called the climate tech sector (See #1). Given the recent surge in interest in this space, I thought it would be worthwhile to record a handful of lessons that Ive learned from this exp… [+10487 chars]","Over the past five years, I’ve worked at two startups in what is now being called the climate tech sector (See #1). Given the recent surge in interest in this space, I thought it would be worthwhile to record a handful of lessons that I’ve learned from this e…","2020-03-20T13:14:44Z","the-next-web","The Next Web","6 things I learned from working in climate tech startups","https://thenextweb.com/?p=1279852","https://img-cdn.tnwcdn.com/image/tnw?filter_last=1&fit=1280%2C640&url=https%3A%2F%2Fcdn0.tnwcdn.com%2Fwp-content%2Fblogs.dir%2F1%2Ffiles%2F2020%2F03%2Fclimate-tech.png&signature=5cdf66349f1cf19270de17da05830166"
"Adele Peters","An important thing to realize for anyone thinking about the climate crisis is that things are not hopeless. In fact, the solutions the world needs to tackle climate change already exist. A new report from the nonprofit Project Drawdown analyzed the potential … [+5782 chars]","Onshore wind power, utility-scale solar power, reduced food waste: These are just the first three of Project Drawdown’s plan to end the climate crisis with existing technologies. An important thing to realize for anyone thinking about the climate crisis is th…","2020-03-03T00:01:15Z","","Fastcompany.com","These are the 76 climate solutions we need to scale up right now to have a chance","https://www.fastcompany.com/90470151/these-are-the-76-climate-solutions-we-need-to-scale-up-right-now-to-have-a-chance?partner=feedburner&utm_source=feedburner&utm_medium=feed&utm_campaign=Feed%3A+fastcompany%2Fheadlines+%28Fast+Company%29","https://images.fastcompany.net/image/upload/w_1280,f_auto,q_auto,fl_lossy/wp-cms/uploads/2020/02/p-1-90470151-these-are-the-76-climate-solutions-we-need-to-scale-up.jpg"
"Ainsley Harris","From a distance, the Lenten display in the chancel of St. John United Lutheran Church in Seattle looks similar to displays installed by churches around the world in the weeks leading up to Easter Sunday. Sunlight streams through stained glass windows. A gothi… [+10624 chars]","The biblical mandate of “creation care” is taking on new urgency as the planet warms. From a distance, the Lenten display in the chancel of St. John United Lutheran Church in Seattle looks similar to displays installed by churches around the world in the week…","2020-03-23T06:00:22Z","","Fastcompany.com","Meet the Christians giving up carbon for Lent","https://www.fastcompany.com/90468537/meet-the-christians-giving-up-carbon-for-lent","https://images.fastcompany.net/image/upload/w_1280,f_auto,q_auto,fl_lossy/wp-cms/uploads/2020/03/p-1-90468537-meet-the-christians-giving-up-carbon-and-single-use-plastic-for-lent.jpg"
"Kristin Toussaint","With the demand for flights drastically down amid the coronavirus outbreak, the airline industry is reeling. Avoiding air travel is top of mind for most of the public, and that means revenue losses—of up to $113 billion, according to the International Air Tra… [+5566 chars]","Even without ghost flights—empty planes that help an airline hold onto flight slots—the coronavirus highlights the environmental impact of the aviation industry. With the demand for flights drastically down amid the coronavirus outbreak, the airline industry …","2020-03-11T16:00:25Z","","Fastcompany.com","Airlines will stop coronavirus ‘ghost flights’—now we need to rethink the future of flying","https://www.fastcompany.com/90476154/airlines-will-stop-coronavirus-ghost-flights-now-we-need-to-rethink-the-future-of-flying?partner=feedburner&utm_source=feedburner&utm_medium=feed&utm_campaign=Feed%3A+fastcompany%2Fheadlines+%28Fast+Company%29","https://images.fastcompany.net/image/upload/w_1280,f_auto,q_auto,fl_lossy/wp-cms/uploads/2020/03/p-1-90476154-airlines-will-stop-coronavirus-and8216ghost-flightsand8217now-we-need-to-rethink-the-future-of-flying.jpg"
"Chris Impey","Science gets a lot of respect these days. Unfortunately, it’s also getting a lot of competition from misinformation. Seven in 10 Americans think the benefits from science outweigh the harms, and nine in 10 think science and technology will create more opportu… [+6276 chars]","Many Americans have holes in their understanding of basic science—making them particularly susceptible to misinformation. Science gets a lot of respect these days. Unfortunately, it’s also getting a lot of competition from misinformation. Seven in 10 American…","2020-03-14T09:00:03Z","","Fastcompany.com","Why people are so easily fooled by conspiracy theories they read online","https://www.fastcompany.com/90474525/why-people-are-so-easily-fooled-by-conspiracy-theories-they-read-online","https://images.fastcompany.net/image/upload/w_1280,f_auto,q_auto,fl_lossy/wp-cms/uploads/2020/03/p-1-tabloids-fake-science.jpg"
"Marcus Baram","The recovery from the financial crisis was reportedly in full swing, with unemployment on the decline and the economy seemingly on the mend. The advance of digital culture was hurtling forward, shortening attention spans and leading print book sales to plumme… [+14711 chars]","The French economist, whose first “Capital” book in 2014 became a surprise bestseller with its deep analysis of income inequality over the centuries, is back—and this time offering solutions to the complex problem in his new book, “Capital and Ideology.” The …","2020-03-14T13:48:59Z","","Fastcompany.com","Thomas Piketty explains why the world is ripe for ‘participatory socialism’","https://www.fastcompany.com/90476804/thomas-piketty-explains-why-the-world-is-ripe-for-participatory-socialism","https://images.fastcompany.net/image/upload/w_1280,f_auto,q_auto,fl_lossy/wp-cms/uploads/2020/03/p-1-90476804-thomas-piketty-explains-why-the-world-is-ripe-for-and8216participatory-socialismand8217.png"
"By Jennifer Hiller and Ron Bousso","By Jennifer Hiller and Ron Bousso\\n\\nNEW YORK/LONDON (Reuters) - Exxon and Chevron boasted to investors this week about booming U.S. oil production, illustrating how the gap has widened - at least in words - between top American oil and gas companies and their … [+4217 chars]","NEW YORK/LONDON (Reuters) - Exxon and Chevron boasted to investors this week about booming U.S. oil production, illustrating how the gap has widened - at least in words - between top American oil and gas companies and their European rivals over efforts to tra…","2020-03-05T18:25:02Z","","Yahoo.com","U.S. oil boom vs Europe's renewables focus? Big Oil's gap widens -- in words","https://news.yahoo.com/u-oil-boom-vs-europes-182502023.html","https://s.yimg.com/ny/api/res/1.2/4iJS9agY4HPI0DKT8VALFg--/YXBwaWQ9aGlnaGxhbmRlcjt3PTEyODA7aD04NTIuOA--/https://s.yimg.com/uu/api/res/1.2/HOfpWQRv4oHDSAat.pB1DQ--~B/aD01MzM7dz04MDA7c209MTthcHBpZD15dGFjaHlvbg--/https://media.zenfs.com/en-US/reuters.com/f8b315031088f2460a78323ca18f9125"
"FRANK JORDANS / AP","(BERLIN) — Scientists say that half of the world’s sandy beaches could disappear by the end of the century if climate change continues unchecked.\\n\\nResearchers at the European Union’s Joint Research Center in Ispra, Italy, used satellite images to track the wa… [+3233 chars]","Scientists say that half of the world's sandy beaches could disappear by the end of the century if climate change continues unchecked.","2020-03-02T18:02:13Z","time","Time","Rising Sea Levels, Coastal Erosion: New Report Says Half the World’s Sandy Beaches at Risk From Climate Change By 2100","https://time.com/5793668/sandy-beaches-climate-change/","https://api.time.com/wp-content/uploads/2020/03/climate-change-sand-beach.jpg?quality=85&w=1200&h=628&crop=1"
"Justin Worland","The rise of Bernie Sanders as the Democratic Party’s presidential frontrunner has shaken up politicians and pundits surprised that an avowedly left-wing candidate is beating more traditional rivals. These political insiders have speculated about a wide range … [+4754 chars]","The rise of Bernie Sanders as the Democratic Party’s presidential frontrunner has shaken up politicians and pundits surprised that an avowedly left-wing candidate is beating more traditional rivals. These political insiders have speculated about a wide range …","2020-03-02T17:10:01Z","time","Time","How Climate Change Helped Fuel Bernie Sanders’s Rise to the Top of the Polls","https://time.com/5793592/bernie-sanders-climate-change-polls/","https://api.time.com/wp-content/uploads/2020/02/bernie-sanders-aoc-climate-change.jpg?quality=85&w=1024&h=628&crop=1"
"Ian Bremmer","For a war that’s supposedly been won, Syria continues to bleed refugees at an alarming rate. Idlib, a city in the country’s northwest, is the final rebel holdout that keeps Bashar al-Assad—and his Russian backers—from complete victory in his country’s nine-ye… [+7277 chars]","For a war that’s supposedly been won, Syria continues to bleed refugees at an alarming rate. Idlib, a city in the country’s northwest, is the final rebel holdout that keeps Bashar al-Assad—and his Russian backers—from complete victory in his country’s nine-ye…","2020-03-08T21:02:09Z","time","Time","What Happens Next with Europe’s Latest Refugee Crisis","https://time.com/5798139/what-happens-next-with-europes-latest-refugee-crisis/","https://api.time.com/wp-content/uploads/2020/03/turkey-syria-border-conflict.jpg?quality=85&w=1024&h=628&crop=1"
