author,content,description,publishedAt,source/id,source/name,title,url,urlToImage
"Thom Dunn","In an interview with Ellen Degeneres, NBA player Dwyane Wade discussed how he and his wife support and empower their teenaged child Zaya. [YouTube]\\n\\nMore than 40 years ago, Eric McMillan, a renowned designer of children’s play areas, and his team created the … [+1548 chars]","At least some things in the world are still adorable. From RTÉ : The Kelly's have four boys who are just one day shy of their fifth birthday. Now they have been gifted an early birthday present of quad lambs. Quadruplet brothers in Co Offaly have met recent a…","2020-02-28T12:40:14Z","","Boingboing.net","Quadruplet human kids get quadruplet lamb kids for their birthday","https://boingboing.net/2020/02/28/quadruplet-human-kids-get-quad.html","https://i2.wp.com/media.boingboing.net/wp-content/uploads/2020/02/nature-grass-meadow-view-animal-cute-1242531-pxhere.com_.jpg?fit=1200%2C829&ssl=1"
"David Pescovitz","The principal of Lafayette Elementary School in Washington DC has apologized after a fifth grade lesson on the Civil War and Reconstruction had some children of color role-playing “a person of color drinking from a segregated water fountain and an enslaved pe… [+1878 chars]","Yale psychology professor Laurie Santos's course “Psychology and the Good Life"" is the most popular class in the history of the university. Now it's available for anyone to take for free remotely through Coursera. The public online version of the class is cal…","2020-03-24T18:41:34Z","","Boingboing.net","Yale University's hugely popular ""Science of Well Being"" happiness class is now free online","https://boingboing.net/2020/03/24/yale-universitys-hugely-popu.html","https://i2.wp.com/media.boingboing.net/wp-content/uploads/2020/03/Mr-400x400-1.jpg?fit=400%2C400&ssl=1"
"Ed Mazza","President Donald Trump announced on Wednesday that Vice President Mike Pence would lead the White House task force on COVID-19, the deadly new coronavirus infection spreading around the world. But critics are pointing out that Pence’s track record on health a… [+382 chars]","The vice president has no medical experience -- and that's not the only problem.","2020-02-27T07:26:44Z","","Huffpost.com","Trump Ripped For Putting ‘Science-Denier’ Pence In Charge Of Coronavirus","https://www.huffpost.com/entry/trump-pence-coronavirus_n_5e574261c5b66622ed768d31","https://img.huffingtonpost.com/asset/5e575b50230000250c0bf3ce.jpeg?cache=hZmxqAcBG5&ops=1200_630"
"Mary Papenfuss","Sen. Ted Cruz (R-Texas) tried to denigrate Democratic Rep. Alexandria Ocasio-Cortez’s scientific knowledge Friday after she slammed President Donald Trump for putting Vice President Mike Pence in charge of protecting the nation from the new coronavirus. The N… [+1366 chars]","Rep. Alexandria Ocasio-Cortez and the Texas senator go at it over Mike Pence's selection as leader of battle against the spreading coronavirus.","2020-02-29T02:53:30Z","","Huffpost.com","Ted Cruz Mocks AOC’s Science Chops; She Reminds Him He Doesn’t Believe In Evolution","https://www.huffpost.com/entry/alexandria-ocasio-cortez-ted-cruz-mike-pence-evoution-coronavirus_n_5e59b67ac5b601022110d0d3","https://img.huffingtonpost.com/asset/5e59ba942300005d0d0bf5e8.jpeg?cache=Zj0PWhZgzX&ops=1200_630"
"Emily Peck","It shouldn’t take a global epidemic to make people realize that paid sick leave is a critical economic policy, but here we are.  \\n\\nAs coronavirus sweeps through the country, the fact that the U.S. is one of only a few developed countries that does not guarant… [+5600 chars]","Too bad it took the massive coronavirus outbreak to get (almost) everyone on board.","2020-03-11T15:34:47Z","","Huffpost.com","Finally, Everyone Understands Why Paid Sick Leave Is Necessary","https://www.huffpost.com/entry/paid-sick-leave-coronavirus-covid-19_n_5e68f415c5b6670e730215e9","https://img.huffingtonpost.com/asset/5e68f596230000c21a0c0f02.jpeg?ops=1200_630"
"Hobbins, M., Barsugli, J.","","As the beating heart of the American Southwest, the Colorado River (CR) serves ∼40 million people from Denver to Los Angeles and supports 16 million jobs in a $1.4 trillion regional economy ([ 1 ][1]). Most of the river's streamflow originates as snowpack in …","2020-03-12T17:40:40Z","","Sciencemag.org","Threatening the vigor of the Colorado River","https://science.sciencemag.org/content/367/6483/1192.full","https://science.sciencemag.org/content/367/6483/F1.medium.gif"
"USA TODAY, Doyle Rice, USA TODAY","Story Highlights\\n\\n<ul><li>If the current melting trend continues, the regions will be on track to match the ""worst-case"" scenario.</li><li>All total, Greenland and Antarctica have lost 6.4 trillion tons of ice since the 1990s.</li><li>""Every centimeter of sea… [+2707 chars]","Greenland and Antarctica have lost 6.4 trillion tons of ice in the past three decades, accelerating sea-level rise around the world.","2020-03-16T19:23:10Z","usa-today","USA Today","Greenland and Antarctica are now melting six times faster than in the 1990s, accelerating sea-level rise","https://www.usatoday.com/story/news/world/2020/03/16/climate-change-greenland-antarctica-melting-6-times-faster-than-90-s/5060236002/","https://www.gannett-cdn.com/presto/2020/03/16/USAT/f5ad756b-c836-42d0-a6cc-cce346f99b04-greenland20200316-16.jpg?crop=1394,785,x0,y0&width=1600&height=800&fit=bounds"
"Chris Ciaccia","Almost half of the world's sandy beaches could be gone by 2100 if climate change continues as is, according to a new study published on Monday.\\n\\nThe research, published in the scientific journal Nature Climate Change, forecasts that coastlines, which are dens… [+4108 chars]","Almost half of the world's sandy beaches could be gone by 2100 if climate change continues as is, according to a new study published on Monday.","2020-03-02T17:49:42Z","fox-news","Fox News","Half of world’s beaches will disappear by 2100 because of climate change, experts say","https://www.foxnews.com/science/half-worlds-beaches-disappear-by-2100-climate-change","https://static.foxnews.com/foxnews.com/content/uploads/2020/03/climate-change-beach-3.jpg"
"Julia Musto","The world's tropical forests are losing their capacity to absorb carbon dioxide, according to a new environmental study, raising alarms about the prospect of accelerating climate breakdown.\\n\\nThe study, which was published Wednesday in the scientific journal N… [+4285 chars]","A new study is reporting that the world's tropical forests are losing their capacity to absorb carbon dioxide (C02), raising alarms about the prospect of accelerating increasing climate breakdown.","2020-03-07T13:56:23Z","fox-news","Fox News","Tropical forests losing their ability to absorb carbon: study","https://www.foxnews.com/science/tropical-forests-losing-ability-absorb-carbon","https://static.foxnews.com/foxnews.com/content/uploads/2019/08/AP19235667684088.jpg"
"","In the Review What would it take for renewably powered electrosynthesis to displace petrochemical processes?, a stoichiometry error led to incorrect values for CO2 emitted per kilogram of product for ethylene and ethanol. The correct values are now used: 1.57… [+2951 chars]","In the Review “[What would it take for renewably powered electrosynthesis to displace petrochemical processes?][1],” a stoichiometry error led to incorrect values for CO2 emitted per kilogram of product for ethylene and ethanol. The correct values are now use…","2020-03-05T18:39:33Z","","Sciencemag.org","Erratum for the Review: ""What would it take for renewably powered electrosynthesis to displace petrochemical processes?"" by P. De Luna, C. Hahn, D. Higgins, S. A. Jaffer, T. F. Jaramillo, E. H. Sargent","https://science.sciencemag.org/content/367/6482/eabb0992.full","https://science.sciencemag.org/sites/default/files/highwire/sci/367/6482.cover-source.gif"
"Masanet, E., Shehabi, A., Lei, N., Smith, S., Koomey, J.","","Data centers represent the information backbone of an increasingly digitalized world. Demand for their services has been rising rapidly ([ 1 ][1]), and data-intensive technologies such as artificial intelligence, smart and connected energy systems, distribute…","2020-02-27T18:39:43Z","","Sciencemag.org","Recalibrating global data center energy-use estimates","https://science.sciencemag.org/content/367/6481/984.full","https://science.sciencemag.org/content/367/6481/F1.medium.gif"
"Grundy, W. M., Bird, M. K., Britt, D. T., Cook, J. C., Cruikshank, D. P., Howett, C. J. A., Krijt, S., Linscott, I. R., Olkin, C. B., Parker, A. H., Protopapa, S., Ruaud, M., Umurhan, O. M., Young, L. A., Dalle Ore, C. M., Kavelaars, J. J., Keane, J. T., Pendleton, Y. J., Porter, S. B., Scipioni, F., Spencer, J. R., Stern, S. A., Verbiscer, A. J., Weaver, H. A., Binzel, R. P., Buie, M. W., Buratti, B. J., Cheng, A., Earle, A. M., Elliott, H. A., Gabasova, L., Gladstone, G. R., Hill, M. E., Horanyi, M., Jennings, D. E., Lunsford, A. W., McComas, D. J., McKinnon, W. B., McNutt, R. L., Moore, J. M., Parker, J. W., Quirico, E., Reuter, D. C., Schenk, P. M., Schmitt, B., Showalter, M. R., Singer, K. N., Weigle, G. E., Zangari, A. M.","Structured Abstract\\n\\nAbstract\\n\\nThe outer Solar System object (486958) Arrokoth (provisional designation 2014 MU69) has been largely undisturbed since its formation. We studied its surface composition using data collected by the New Horizons spacecraft. Methan… [+46261 chars]","The New Horizons spacecraft flew past the Kuiper Belt object (486958) Arrokoth (also known as 2014 MU69) in January 2019. Because of the great distance to the outer Solar System and limited bandwidth, it will take until late 2020 to downlink all the spacecraf…","2020-02-27T18:39:44Z","","Sciencemag.org","Color, composition, and thermal environment of Kuiper Belt object (486958) Arrokoth","https://science.sciencemag.org/content/367/6481/eaay3705.full","https://science.sciencemag.org/content/367/6481/F1.medium.gif"
"Beth Elderkin","Game designer Elizabeth Hargrave helped jumpstart a tabletop revolution with Wingspan, an environmental board game about creating habitats for birds. Her upcoming release, Mariposas, has players guiding monarch butterflies on their migration. But theres somet… [+10927 chars]","Game designer Elizabeth Hargrave helped jumpstart a tabletop revolution with Wingspan, an environmental board game about creating habitats for birds. Her upcoming release, Mariposas, has players guiding monarch butterflies on their migration. But there’s some…","2020-02-26T21:00:00Z","","Gizmodo.com","Why It's Hard, But Not Impossible, to Make a Board Game About Climate Change","https://io9.gizmodo.com/why-its-hard-but-not-impossible-to-make-a-board-game-1841703774","https://i.kinja-img.com/gawker-media/image/upload/c_fill,f_auto,fl_progressive,g_center,h_675,pg_1,q_80,w_1200/ttackkaengtmzyv3xcrf.png"
"https://www.facebook.com/bbcnews","Image copyrightReutersImage caption\\n\\n Researchers say climate change is behind the longer summers\\n\\nAustralia's summers have become twice as long as its winters amid increasing temperatures driven by climate change, according to new weather data analysis.\\n\\nThe… [+2208 chars]","New weather data analysis says climate change has led to major increases in summer temperatures.","2020-03-01T20:23:56Z","bbc-news","BBC News","Climate change: Australian summers 'twice as long as winters'","https://www.bbc.co.uk/news/world-australia-51697803","https://ichef.bbci.co.uk/news/1024/branded_news/24A3/production/_111097390_c586d1d5-bfb5-41bb-957e-1895844e6bb8.jpg"
"Contributors to Wikimedia projects","A global catastrophic risk is a hypothetical future event which could damage human well-being on a global scale,[2] even endangering or destroying modern civilization.[3] An event that could cause human extinction or permanently and drastically curtail humani… [+78416 chars]","Comments","2020-03-25T00:14:14Z","","Wikipedia.org","Global Catastrophic Risk","https://en.wikipedia.org/wiki/Global_catastrophic_risk","https://upload.wikimedia.org/wikipedia/commons/c/cb/Impact_event.jpg"
"","New York / Geneva, 10 March 2020 - The tell-tale physical signs of climate change such as increasing land and ocean heat, accelerating sea level rise and melting ice are highlighted in a new report compiled by the World Meteorological Organization and an exte… [+16474 chars]","The tell-tale physical signs of climate change such as increasing land and ocean heat, accelerating sea level rise and melting ice are highlighted in a new report compiled by the World Meteorological Organization and an extensive network of partners. It docum…","2020-03-12T18:58:01Z","","Wmo.int","Planet is 'way off track' in dealing with climate change, U.N. report says","https://public.wmo.int/en/media/press-release/multi-agency-report-highlights-increasing-signs-and-impacts-of-climate-change",""
"Miguel Trancozo Trevino","As the guardians of the wells and suppliers of the water, it also gave the women in the community a certain degree of status and autonomy, but at the same time, with the situation of global warming and climate change, the amount of water available for the com… [+1641 chars]","In chronically dry regions around the world, communities are finding ways to live from the water suspended in the air – creating valuable drinking water from mist.","2020-03-01T09:25:44Z","","Bbc.com","The ethereal art of fog-catching","https://www.bbc.com/future/article/20200221-how-fog-can-solve-water-shortage-from-climate-change-in-peru","https://ichef.bbci.co.uk/wwfeatures/live/624_351/images/live/p0/84/7p/p0847pq9.jpg"
"Contributors to Wikimedia projects","Freeman John DysonFRS (15 December 1923 28 February 2020) was an American theoretical physicist and mathematician, of British origin, known for his work in quantum electrodynamics, solid-state physics, astronomy and nuclear engineering.[7][8] He is professor … [+50317 chars]","Comments","2020-02-28T17:25:08Z","","Wikipedia.org","Freeman Dyson Has Died","https://en.wikipedia.org/wiki/Freeman_Dyson","https://upload.wikimedia.org/wikipedia/commons/0/03/Freeman_Dyson_%282005%29.jpg"
"Contributors to Wikimedia projects","The Doomsday Clock is a symbol that represents the likelihood of a man-made global catastrophe. Maintained since 1947 by the members of the Bulletin of the Atomic Scientists,[1] the Clock is a metaphor for threats to humanity from unchecked scientific and tec… [+26628 chars]","Comments","2020-03-04T19:12:14Z","","Wikipedia.org","Doomsday Clock at the shortest distance to midnight ever","https://en.wikipedia.org/wiki/Doomsday_Clock",""
"Natalie Wolchover","Editor's Note: An original version of this article, written by Natalie Wolchover, appeared on Live Science Oct. 26, 2012. An updated version by Live Science staff was republished on May 30, 2017.\\n\\nMembers of the Flat Earth Society claim to believe the Earth i… [+10228 chars]","Comments","2020-03-23T09:25:34Z","","Livescience.com","Are Flat Earthers Being Serious?","https://www.livescience.com/24310-flat-earth-belief.html","https://cdn.mos.cms.futurecdn.net/A48entFsWFbCRXNzXThyrL-1200-80.jpg"
"Contributors to Wikimedia projects","A wicked problem is a problem that is difficult or impossible to solve because of incomplete, contradictory, and changing requirements that are often difficult to recognize. It refers to an idea or problem that can not be fixed, where there is no single solut… [+23236 chars]","Comments","2020-03-02T22:27:57Z","","Wikipedia.org","Wicked problem","https://en.wikipedia.org/wiki/Wicked_problem",""
"Jason Jacobs","Todays guest is David Heinemeier Hansson (aka @DHH), Co-Founder &amp; CTO of Basecamp, an online collaboration tool. \\n\\nDavid is a prominent figure in the tech industry and a polymath whose writings and opinions have touched upon a range of subjects, including… [+57392 chars]","Today’s guest is David Heinemeier Hansson (aka @DHH), Co-Founder &amp; CTO of Basecamp, an online collaboration tool.    David is a prominent figure in the tech industry and a polymath whose writings and opinions have touched upon a range of subjects, includi…","2020-02-27T11:42:36Z","","Myclimatejourney.co","DHH on climate change and “taking the red pill”","https://www.myclimatejourney.co/episodes/david-heinemeier-hansson","http://static1.squarespace.com/static/5ca65ab377b9030e46ce0156/t/5e5048e32772ef171f954c8a/1582319850750/DHH%2BPhoto.jpg?format=1500w"
"","Freeman Dyson the world-renowned mathematical physicist who helped found quantum electrodynamics with the bongo-playing, Nobel Prize-winning physicist Richard Feynman and others, devised numerous mathematical techniques, led the team that designed a low-power… [+15267 chars]","A conversation with the mathematical physicist Freeman Dyson on quantum electrodynamics, climate change and his latest pet project.","2020-02-28T18:27:58Z","","Quantamagazine.org","Freeman Dyson: A ‘Rebel’ Without a PhD","https://www.quantamagazine.org/a-math-puzzle-worthy-of-freeman-dyson-20140326/","https://d2r55xnwy6nx47.cloudfront.net/uploads/2014/03/dyson_landing.jpg"
"","I first met Jimbo Wales, the face of Wikipedia, when he came to speak at Stanford. Wales told us about Wikipedia’s history, technology, and culture, but one thing he said stands out. “The idea that a lot of people have of Wikipedia,” he noted, “is that it’s s… [+66783 chars]","Comments","2020-03-03T06:18:50Z","","Aaronsw.com","Who Writes Wikipedia?","http://www.aaronsw.com/weblog/whowriteswikipedia.html",""
"Maddie Stone, Jordan Pearson","The Great Barrier Reef, the largest living structure on the planet, appears to be on the brink of yet another devastating mass bleaching event driven by prolonged exposure to extreme heat.\\n\\n Between 2016 and 2017, half of all corals on the Great Barrier Reef … [+4399 chars]","Forecasts for the largest living structure on Earth have become ""devastating,"" scientists say, and the coral carnage will be even more widespread than the last mass bleaching in 2016-2017.","2020-03-04T16:06:41Z","vice-news","Vice News","The Great Barrier Reef Is Heading for a Mass Die-Off of Unprecedented Scale","https://www.vice.com/en_us/article/y3mxmg/great-barrier-reef-coral-bleaching-2020","https://video-images.vice.com/test-uploads/articles/5e5fcb04a8b206009b8aa173/lede/1583337779185-GettyImages-694750716.jpeg?crop=1xw:0.8604xh;0xw,0.0443xh&resize=1200:*"
"Becky Ferreira, Jordan Pearson","On Christmas Eve, 1968, the astronauts aboard NASAs Apollo 8 spacecraft became the first humans to behold the entirety of Earth with their own eyes. That day, crew member Bill Anders took an iconic photograph called Earthrise'' that captured our home world em… [+16284 chars]","New high-resolution satellites, AIs, and data tools are going to let us study Earth, and ourselves, in greater detail than ever before. That's going to come with ""unthinkable"" problems.","2020-03-16T12:00:00Z","vice-news","Vice News","New Earth Surveillance Tech Is About to Change Everything, Including Us","https://www.vice.com/en_us/article/wxebk5/new-earth-surveillance-tech-is-about-to-change-everything-including-us","https://video-images.vice.com/test-uploads/articles/5e6be6a453b759009d3d0cab/lede/1584129766813-3_12_2020_geospatial_tech_cv.jpeg?crop=1xw:1xh;center,center&resize=1200:*"
"Chelsea Harvey, E&E News","President Trump assured the American public that the onset of warmer weather could halt the spread of the coronavirus. But experts caution there's no evidence to support that idea.\\n\\nHis assertion raises new questions about the role temperatures have on infect… [+9261 chars]","Scientists expect to see changes in the timing, location and severity of disease outbreaks as global temperatures rise -- Read more on ScientificAmerican.com","2020-03-09T20:00:00Z","","Scientificamerican.com","What Could Warming Mean for Pathogens Like Coronavirus?","https://www.scientificamerican.com/article/what-could-warming-mean-for-pathogens-like-coronavirus/","https://static.scientificamerican.com/sciam/cache/file/DA67D949-C678-4021-9BA5F5B00C81E42A.jpg"
"Andrea Thompson","It was only last week that the massive wildfires that, in January, began tearing through the national park near Australia’s capital city of Canberra were finally declared out. In the intervening weeks they consumed more than 80 percent of the park. This is ju… [+5911 chars]","Such an extreme fire season is at least 30 percent more likely because of global warming, a new analysis finds -- Read more on ScientificAmerican.com","2020-03-04T20:45:00Z","","Scientificamerican.com","Yes, Climate Change Did Influence Australia's Unprecedented Bushfires","https://www.scientificamerican.com/article/yes-climate-change-did-influence-australias-unprecedented-bushfires/","https://static.scientificamerican.com/sciam/cache/file/9775A8FB-E31C-4667-B665FBAAFF2C30B3.jpg"
"Chelsea Harvey, E&E News","Small levels of global warming can increase the likelihood of extreme events, new research warns. That’s prompting scientists to question how accurately disasters in the recent past can be used to predict extreme events today.\\n\\nA study published Wednesday in … [+4727 chars]","The likelihood of extreme events today is being underestimated, new research suggests -- Read more on ScientificAmerican.com","2020-03-20T16:30:00Z","","Scientificamerican.com","In Just 10 Years, Warming Has Increased the Odds of Disasters","https://www.scientificamerican.com/article/in-just-10-years-warming-has-increased-the-odds-of-disasters/","https://static.scientificamerican.com/sciam/cache/file/EB8D4682-D993-4634-A6A4BF67759DD5BC.jpg"
"Andrea Thompson","When Christiana Figueres took the reins of the United Nations’ international climate negotiations in 2010, hopes were not high that the world would come together to forge an agreement to tackle global warming—especially after talks had fallen apart in Copenha… [+10711 chars]","It is possible for the world to cut emissions enough to limit warming to 1.5 degrees Celsius. But tenacious belief will be needed to achieve that goal -- Read more on ScientificAmerican.com","2020-03-24T10:45:00Z","","Scientificamerican.com","Paris Climate Agreement Architects Make a Case for ""Stubborn Optimism""","https://www.scientificamerican.com/article/paris-climate-agreement-architects-make-a-case-for-stubborn-optimism/","https://static.scientificamerican.com/sciam/cache/file/E51EB0C6-C77E-446C-A7A3342A120538BD.jpg"
"John Fialka, E&E News","Solar energy appears to be heading toward a global growth spurt, due to a combination of new technology and expanding reach to consumers as it becomes more competitive with the cost of traditional energy sources.\\n\\nOne sign of the potential of new technology c… [+3963 chars]","Solar panels floating in reservoirs and other water bodies could meet substantial energy demand -- Read more on ScientificAmerican.com","2020-03-11T18:00:00Z","","Scientificamerican.com","Floating Panels Buoy Predictions of Global Solar Growth Spurt","https://www.scientificamerican.com/article/floating-panels-buoy-predictions-of-global-solar-growth-spurt/","https://static.scientificamerican.com/sciam/cache/file/14638777-7276-444A-B343E9BE00CD27E2.jpg"
"Lee Billings","The universe in which the classic PBS series Cosmos debuted 40 years ago no longer really exists. In 1980 the Internet was in its infancy, scientists were just starting to sound the alarm about global warming, and present-day scientific realities such as exop… [+498 chars]","Cosmos co-creator discusses communicating her dream for humanity -- Read more on ScientificAmerican.com","2020-03-03T14:00:00Z","","Scientificamerican.com","Ann Druyan Is Reimagining the Future","https://www.scientificamerican.com/article/ann-druyan-is-reimagining-the-future/","https://static.scientificamerican.com/sciam/cache/file/BC7C46F4-04A6-49A9-B630A3CF089A1D2F.jpg"
"Scott Waldman, E&E News","In selecting Rep. Mark Meadows of North Carolina to serve as his next chief of staff, President Trump is bringing into the White House a Republican lawmaker who has raised concerns about climate change and expressed a desire to do something about it.\\n\\nThe app… [+6151 chars]","While he opposed the Paris climate agreement, Rep. Mark Meadows has signaled support for renewables and a possible carbon tax -- Read more on ScientificAmerican.com","2020-03-10T17:45:00Z","","Scientificamerican.com","Trump's Next Chief of Staff Is Open to Doing More on Climate","https://www.scientificamerican.com/article/trumps-next-chief-of-staff-is-open-to-doing-more-on-climate/","https://static.scientificamerican.com/sciam/cache/file/C93573B5-7C91-48C6-A3CE92E4E1B50A6C.jpg"
"Chelsea Harvey, E&E News","Enormous, swirling gyres compose some of the world’s biggest and most important ocean currents. Found in the North and South Pacific, the North and South Atlantic, and the Indian Ocean, these massive, rotating currents help transport heat and nutrients around… [+4072 chars]","The shift, which may be linked to climate change, can affect sea levels and the distribution of heat and nutrients -- Read more on ScientificAmerican.com","2020-02-28T17:30:00Z","","Scientificamerican.com","The Ocean's Swirling Currents Are Migrating Poleward","https://www.scientificamerican.com/article/the-oceans-swirling-currents-are-migrating-poleward/","https://static.scientificamerican.com/sciam/cache/file/A0718230-A4ED-4727-92A96C4B8FA22672.jpg"
